{
  "schema_version": "human_ai.communication_event.v1",
  "event_id": "protected",
  "task_id": "human-ai-communication-compliance-fixture",
  "event_type": "source_publication",
  "claimed_event_class": "C2",
  "provider": "ChatGPT",
  "occupied_role": "foreground_review_and_task_dispatch",
  "bootstrap_receipt": {
    "schema_version": "human_ai.communication_bootstrap_receipt.v1",
    "receipt_id": "fixture-receipt-chatgpt",
    "protocol_release_head": "94f07f05e584053000cdb74f3db75c9128975c2a",
    "provider": "ChatGPT",
    "occupied_role": "foreground_review_and_task_dispatch",
    "wire_schema": "chatgpt_to_codex_v1",
    "loaded_files": [
      {
        "commit": "94f07f05e584053000cdb74f3db75c9128975c2a",
        "path": "06_Silicon_Index/AI_Bootstrap_Sequence.md",
        "content_sha256": "9006f30e88cf17f1fc4f7cdfe5678c4b2f84923651234036c3ad9ec509b67281"
      },
      {
        "commit": "94f07f05e584053000cdb74f3db75c9128975c2a",
        "path": "AGENTS.md",
        "content_sha256": "78cfa82132e074ebefe46f6bb2778238839ef42e9746fe78f80f3f31e3f182c7"
      },
      {
        "commit": "94f07f05e584053000cdb74f3db75c9128975c2a",
        "path": ".ai/HANDOFF_INIT_PROMPT.md",
        "content_sha256": "a6f76b84e89c847e2846db58136b92df21272395ac0100d820d34f1192a575ce"
      },
      {
        "commit": "94f07f05e584053000cdb74f3db75c9128975c2a",
        "path": ".ai/PROTOCOL.md",
        "content_sha256": "f17f373685291b7bf5aab20cd234b64218cc4405b5a9a0ce7476fcac39b6abce"
      },
      {
        "commit": "94f07f05e584053000cdb74f3db75c9128975c2a",
        "path": ".ai/PROTOCOL_ADHERENCE.md",
        "content_sha256": "7f3580b492e6d923568c0c58ed3722aede0bb1fd81f0f2848b53ecd7f4d264ef"
      },
      {
        "commit": "94f07f05e584053000cdb74f3db75c9128975c2a",
        "path": ".ai/HANDOFF_COMMON_CONVENTIONS.md",
        "content_sha256": "3479f948dd1d52f061f1893a6fc6436b2b968dda6ac6d766688ef3f27f4554d7"
      },
      {
        "commit": "94f07f05e584053000cdb74f3db75c9128975c2a",
        "path": ".ai/AUTONOMOUS_HANDOFF_COMMUNICATION_v0.1.md",
        "content_sha256": "dde68c78769af8454a3cf67350ce6b7322d7ea5f9f376f948d17686450622d34"
      },
      {
        "commit": "94f07f05e584053000cdb74f3db75c9128975c2a",
        "path": ".ai/CODEX_WORK_MECHANISM_PROTOCOL.md",
        "content_sha256": "5c3f0c6acf12f1eed546088cd9c8a90050859681516de11414029e5a05b04f49"
      },
      {
        "commit": "94f07f05e584053000cdb74f3db75c9128975c2a",
        "path": ".ai/CODEX_TASK_INPUT_CONTRACT.md",
        "content_sha256": "3f2fc98049929777a56fb77a8db56b912d77a953ee00c00a0355a80eae52e565"
      }
    ],
    "inherited_on_demand": [
      {
        "path": ".ai/CODEX_WORK_MECHANISM_PROTOCOL.md",
        "trigger": "backend mechanics",
        "loaded": true
      },
      {
        "path": ".ai/CODEX_TASK_INPUT_CONTRACT.md",
        "trigger": "task parsing",
        "loaded": true
      },
      {
        "path": ".ai/LONG_RUN_AUTONOMOUS_PROGRAM_PROTOCOL.md",
        "trigger": "separate long run",
        "loaded": false
      }
    ],
    "authority_boundary": {
      "receipt_is_authorization": false,
      "protected_actions_need_external_human": true
    },
    "onboarding_answers": {
      "repository_and_source_state": true,
      "role_and_authority": true,
      "always_loaded_files": true,
      "inherited_on_demand_files": true,
      "workflow_state_and_signal": true,
      "non_null_refs": true,
      "human_gate": true,
      "next_action_and_response_shape": true,
      "communication_channels": true,
      "execution_recommendation": true,
      "independent_expression": true,
      "expression_preservation": true,
      "expression_authority_boundary": true,
      "drift_correction": true,
      "role_and_wire_schema": true,
      "mixed_recipient_resolution": true,
      "bootstrap_receipt_capability_boundary": true,
      "c2_external_authority_origin": true
    }
  },
  "pointer": {
    "wire_schema": "chatgpt_to_codex_v1",
    "data": {
      "signal_id": "fixture-signal",
      "decision": "start_task",
      "task_ref": ".ai/CODEX_TASK_INPUT_CONTRACT.md",
      "packet_ref": null,
      "brief_ref": null,
      "source_head": "d235e602c14250d16b91f2897cb8308e031cc13c",
      "human_gate": "approved_to_start_implementation"
    },
    "extra_text": ""
  },
  "required_refs": [
    {
      "kind": "git_blob",
      "commit": "94f07f05e584053000cdb74f3db75c9128975c2a",
      "path": ".ai/PROTOCOL.md",
      "content_sha256": "f17f373685291b7bf5aab20cd234b64218cc4405b5a9a0ce7476fcac39b6abce"
    },
    {
      "kind": "git_blob",
      "commit": "94f07f05e584053000cdb74f3db75c9128975c2a",
      "path": ".ai/CODEX_TASK_INPUT_CONTRACT.md",
      "content_sha256": "3f2fc98049929777a56fb77a8db56b912d77a953ee00c00a0355a80eae52e565"
    }
  ],
  "communication": {
    "recipient_mode": "mixed_separable",
    "channels_separated": true,
    "human_pointer_only_waiver": false,
    "human_operational": {
      "factual_status": "The durable fixture binds physical evidence before a state transition.",
      "execution_recommendation": null,
      "preflight": {
        "factual_status_grounded": true,
        "required_refs_dereferenced": true,
        "canonical_pointer_present_when_applicable": true,
        "execution_recommendation_present_when_dispatching": true,
        "independent_expression_present_for_material_event": true,
        "independent_expression_separated_from_authority": true,
        "no_long_task_or_report_echo": true,
        "no_hidden_chain_of_thought_request_or_disclosure": true
      },
      "independent_expression": {
        "heading": "Independent expression",
        "text": "Physical evidence makes omissions visible. It never grants protected authority.",
        "separated_from_authority": true
      }
    },
    "brief_artifact_ref": null
  },
  "proposed_transition": {
    "transition_id": "protected_publication_entry",
    "from_state": "awaiting_human_gate",
    "to_state": "publication_authorized_in_progress"
  },
  "descriptive_human_gate": "descriptive_only"
}
