{
  "schema_version": "human_ai.communication_event.v1",
  "event_id": "completion",
  "task_id": "human-ai-communication-compliance-fixture",
  "event_type": "completion_handoff",
  "claimed_event_class": "C1",
  "provider": "Codex",
  "occupied_role": "backend_execution_and_handoff",
  "bootstrap_receipt": {
    "schema_version": "human_ai.communication_bootstrap_receipt.v1",
    "receipt_id": "fixture-receipt-codex",
    "protocol_release_head": "8d0c698d67ecc7aa54b0f7cdbf818bbd06dcb993",
    "provider": "Codex",
    "occupied_role": "backend_execution_and_handoff",
    "wire_schema": "codex_to_chatgpt_v1",
    "loaded_files": [
      {
        "commit": "8d0c698d67ecc7aa54b0f7cdbf818bbd06dcb993",
        "path": "06_Silicon_Index/AI_Bootstrap_Sequence.md",
        "content_sha256": "23dc6fde6021870315f232376187e33ee3f0b504b26789ffcfd6d834c2431398"
      },
      {
        "commit": "8d0c698d67ecc7aa54b0f7cdbf818bbd06dcb993",
        "path": "AGENTS.md",
        "content_sha256": "a8fdc48fb7a02686267c3f0f1660db3fd56751aaa9e10fa2543a8cee9270be4c"
      },
      {
        "commit": "8d0c698d67ecc7aa54b0f7cdbf818bbd06dcb993",
        "path": ".ai/HANDOFF_INIT_PROMPT.md",
        "content_sha256": "40e7e227cfe649afe722b1c561f5d00fc748efe51bcc4bc10c883523bfb0a4c1"
      },
      {
        "commit": "8d0c698d67ecc7aa54b0f7cdbf818bbd06dcb993",
        "path": ".ai/PROTOCOL.md",
        "content_sha256": "3c29f8b854a4fcf255699a263a9972235afb30212014eebcb0ff15f1d13f3ff4"
      },
      {
        "commit": "8d0c698d67ecc7aa54b0f7cdbf818bbd06dcb993",
        "path": ".ai/PROTOCOL_ADHERENCE.md",
        "content_sha256": "d0e5321222aa955bc0a15ca47a62f70755035fdc17744311fa6c5b0427d581db"
      },
      {
        "commit": "8d0c698d67ecc7aa54b0f7cdbf818bbd06dcb993",
        "path": ".ai/HANDOFF_COMMON_CONVENTIONS.md",
        "content_sha256": "288761e1ab0851c5951b0ae600891184786f1ce0544ebd370934e23aa4832628"
      },
      {
        "commit": "8d0c698d67ecc7aa54b0f7cdbf818bbd06dcb993",
        "path": ".ai/AUTONOMOUS_HANDOFF_COMMUNICATION_v0.1.md",
        "content_sha256": "dde68c78769af8454a3cf67350ce6b7322d7ea5f9f376f948d17686450622d34"
      },
      {
        "commit": "8d0c698d67ecc7aa54b0f7cdbf818bbd06dcb993",
        "path": ".ai/CODEX_WORK_MECHANISM_PROTOCOL.md",
        "content_sha256": "5c3f0c6acf12f1eed546088cd9c8a90050859681516de11414029e5a05b04f49"
      },
      {
        "commit": "8d0c698d67ecc7aa54b0f7cdbf818bbd06dcb993",
        "path": ".ai/CODEX_TASK_INPUT_CONTRACT.md",
        "content_sha256": "3f2fc98049929777a56fb77a8db56b912d77a953ee00c00a0355a80eae52e565"
      }
    ],
    "inherited_on_demand": [
      {
        "path": ".ai/CODEX_WORK_MECHANISM_PROTOCOL.md",
        "trigger": "backend mechanics",
        "loaded": true
      },
      {
        "path": ".ai/CODEX_TASK_INPUT_CONTRACT.md",
        "trigger": "task parsing",
        "loaded": true
      },
      {
        "path": ".ai/LONG_RUN_AUTONOMOUS_PROGRAM_PROTOCOL.md",
        "trigger": "separate long run",
        "loaded": false
      }
    ],
    "authority_boundary": {
      "receipt_is_authorization": false,
      "protected_actions_need_external_human": true
    },
    "onboarding_answers": {
      "repository_and_source_state": true,
      "role_and_authority": true,
      "always_loaded_files": true,
      "inherited_on_demand_files": true,
      "workflow_state_and_signal": true,
      "non_null_refs": true,
      "human_gate": true,
      "next_action_and_response_shape": true,
      "communication_channels": true,
      "execution_recommendation": true,
      "independent_expression": true,
      "expression_preservation": true,
      "expression_authority_boundary": true,
      "drift_correction": true,
      "role_and_wire_schema": true,
      "mixed_recipient_resolution": true,
      "bootstrap_receipt_capability_boundary": true,
      "c2_external_authority_origin": true
    }
  },
  "pointer": {
    "wire_schema": "codex_to_chatgpt_v1",
    "data": {
      "packet_id": "fixture-packet",
      "status": "awaiting_chatgpt_review",
      "report_ref": ".ai/PROTOCOL.md",
      "brief_ref": null,
      "source_head": "d235e602c14250d16b91f2897cb8308e031cc13c",
      "review_branch_head": "8d0c698d67ecc7aa54b0f7cdbf818bbd06dcb993",
      "human_gate": "not_required"
    },
    "extra_text": ""
  },
  "required_refs": [
    {
      "kind": "git_blob",
      "commit": "8d0c698d67ecc7aa54b0f7cdbf818bbd06dcb993",
      "path": ".ai/PROTOCOL.md",
      "content_sha256": "3c29f8b854a4fcf255699a263a9972235afb30212014eebcb0ff15f1d13f3ff4"
    }
  ],
  "communication": {
    "recipient_mode": "mixed_separable",
    "channels_separated": true,
    "human_pointer_only_waiver": false,
    "human_operational": {
      "factual_status": "The durable fixture binds physical evidence before a state transition.",
      "execution_recommendation": null,
      "preflight": {
        "factual_status_grounded": true,
        "required_refs_dereferenced": true,
        "canonical_pointer_present_when_applicable": true,
        "execution_recommendation_present_when_dispatching": true,
        "independent_expression_present_for_material_event": true,
        "independent_expression_separated_from_authority": true,
        "no_long_task_or_report_echo": true,
        "no_hidden_chain_of_thought_request_or_disclosure": true
      },
      "independent_expression": {
        "heading": "Independent expression",
        "text": "Physical evidence makes omissions visible. It never grants protected authority.",
        "separated_from_authority": true
      }
    },
    "brief_artifact_ref": null
  },
  "proposed_transition": {
    "transition_id": "backend_completion",
    "from_state": "awaiting_codex",
    "to_state": "awaiting_chatgpt_review"
  },
  "descriptive_human_gate": "descriptive_only"
}
