{
  "schema_version": "human_ai.communication_event.v1",
  "event_id": "human-c2",
  "task_id": "human-ai-communication-compliance-fixture",
  "event_type": "source_publication",
  "claimed_event_class": "C2",
  "provider": "Human",
  "occupied_role": "human_speaker",
  "bootstrap_receipt": null,
  "pointer": null,
  "required_refs": [
    {
      "kind": "git_blob",
      "commit": "94f07f05e584053000cdb74f3db75c9128975c2a",
      "path": ".ai/PROTOCOL.md",
      "content_sha256": "f17f373685291b7bf5aab20cd234b64218cc4405b5a9a0ce7476fcac39b6abce"
    },
    {
      "kind": "git_blob",
      "commit": "94f07f05e584053000cdb74f3db75c9128975c2a",
      "path": ".ai/CODEX_TASK_INPUT_CONTRACT.md",
      "content_sha256": "3f2fc98049929777a56fb77a8db56b912d77a953ee00c00a0355a80eae52e565"
    }
  ],
  "communication": {
    "recipient_mode": "human_only",
    "channels_separated": false,
    "human_pointer_only_waiver": false,
    "human_operational": {
      "factual_status": "The durable fixture binds physical evidence before a state transition.",
      "execution_recommendation": null,
      "preflight": {
        "factual_status_grounded": true,
        "required_refs_dereferenced": true,
        "canonical_pointer_present_when_applicable": true,
        "execution_recommendation_present_when_dispatching": true,
        "independent_expression_present_for_material_event": true,
        "independent_expression_separated_from_authority": true,
        "no_long_task_or_report_echo": true,
        "no_hidden_chain_of_thought_request_or_disclosure": true
      },
      "independent_expression": {
        "heading": "Independent expression",
        "text": "Physical evidence makes omissions visible. It never grants protected authority.",
        "separated_from_authority": true
      }
    },
    "brief_artifact_ref": null
  },
  "proposed_transition": {
    "transition_id": "protected_publication_entry",
    "from_state": "awaiting_human_gate",
    "to_state": "publication_authorized_in_progress"
  },
  "descriptive_human_gate": "descriptive_only"
}
