{
  "schema_version": "human_ai.communication_event.v1",
  "event_id": "dispatch",
  "task_id": "human-ai-communication-compliance-fixture",
  "event_type": "backend_dispatch",
  "claimed_event_class": "C1",
  "provider": "ChatGPT",
  "occupied_role": "foreground_review_and_task_dispatch",
  "bootstrap_receipt": {
    "schema_version": "human_ai.communication_bootstrap_receipt.v1",
    "receipt_id": "fixture-receipt-chatgpt",
    "protocol_release_head": "8172f7ed23cffad8a4f619db49d0584ba8d9b607",
    "provider": "ChatGPT",
    "occupied_role": "foreground_review_and_task_dispatch",
    "wire_schema": "chatgpt_to_codex_v1",
    "loaded_files": [
      {
        "commit": "8172f7ed23cffad8a4f619db49d0584ba8d9b607",
        "path": "06_Silicon_Index/AI_Bootstrap_Sequence.md",
        "content_sha256": "ec4cf3d4509f43a27d08a6a92aedeba625e8deb183debc9d39c4aa11094199ce"
      },
      {
        "commit": "8172f7ed23cffad8a4f619db49d0584ba8d9b607",
        "path": "AGENTS.md",
        "content_sha256": "a3e1cb140e01c122e43e544391bb2fb5042eca28bb268fb5f6382c89732441fc"
      },
      {
        "commit": "8172f7ed23cffad8a4f619db49d0584ba8d9b607",
        "path": ".ai/HANDOFF_INIT_PROMPT.md",
        "content_sha256": "40e7e227cfe649afe722b1c561f5d00fc748efe51bcc4bc10c883523bfb0a4c1"
      },
      {
        "commit": "8172f7ed23cffad8a4f619db49d0584ba8d9b607",
        "path": ".ai/PROTOCOL.md",
        "content_sha256": "c0c2485da18e24a0445c6effebe2396ec79a40f374511407edf1c6583b86ebf2"
      },
      {
        "commit": "8172f7ed23cffad8a4f619db49d0584ba8d9b607",
        "path": ".ai/PROTOCOL_ADHERENCE.md",
        "content_sha256": "d0e5321222aa955bc0a15ca47a62f70755035fdc17744311fa6c5b0427d581db"
      },
      {
        "commit": "8172f7ed23cffad8a4f619db49d0584ba8d9b607",
        "path": ".ai/HANDOFF_COMMON_CONVENTIONS.md",
        "content_sha256": "7b7c2cde47c37127a862952a21913b6d039fc54d64ba30fa48ad074157bfc206"
      },
      {
        "commit": "8172f7ed23cffad8a4f619db49d0584ba8d9b607",
        "path": ".ai/AUTONOMOUS_HANDOFF_COMMUNICATION_v0.1.md",
        "content_sha256": "dde68c78769af8454a3cf67350ce6b7322d7ea5f9f376f948d17686450622d34"
      },
      {
        "commit": "8172f7ed23cffad8a4f619db49d0584ba8d9b607",
        "path": ".ai/CODEX_WORK_MECHANISM_PROTOCOL.md",
        "content_sha256": "5c3f0c6acf12f1eed546088cd9c8a90050859681516de11414029e5a05b04f49"
      },
      {
        "commit": "8172f7ed23cffad8a4f619db49d0584ba8d9b607",
        "path": ".ai/CODEX_TASK_INPUT_CONTRACT.md",
        "content_sha256": "b960bb251fa33eaddb2211aa59c02e908dce750ffc6b2b4071042f5effda6616"
      }
    ],
    "inherited_on_demand": [
      {
        "path": ".ai/CODEX_WORK_MECHANISM_PROTOCOL.md",
        "trigger": "backend mechanics",
        "loaded": true
      },
      {
        "path": ".ai/CODEX_TASK_INPUT_CONTRACT.md",
        "trigger": "task parsing",
        "loaded": true
      },
      {
        "path": ".ai/LONG_RUN_AUTONOMOUS_PROGRAM_PROTOCOL.md",
        "trigger": "separate long run",
        "loaded": false
      }
    ],
    "authority_boundary": {
      "receipt_is_authorization": false,
      "protected_actions_need_external_human": true
    },
    "onboarding_answers": {
      "repository_and_source_state": true,
      "role_and_authority": true,
      "always_loaded_files": true,
      "inherited_on_demand_files": true,
      "workflow_state_and_signal": true,
      "non_null_refs": true,
      "human_gate": true,
      "next_action_and_response_shape": true,
      "communication_channels": true,
      "execution_recommendation": true,
      "independent_expression": true,
      "expression_preservation": true,
      "expression_authority_boundary": true,
      "drift_correction": true,
      "role_and_wire_schema": true,
      "mixed_recipient_resolution": true,
      "bootstrap_receipt_capability_boundary": true,
      "c2_external_authority_origin": true
    }
  },
  "pointer": {
    "wire_schema": "chatgpt_to_codex_v1",
    "data": {
      "signal_id": "fixture-signal",
      "decision": "start_task",
      "task_ref": ".ai/CODEX_TASK_INPUT_CONTRACT.md",
      "packet_ref": null,
      "brief_ref": null,
      "source_head": "d235e602c14250d16b91f2897cb8308e031cc13c",
      "human_gate": "approved_to_start_implementation"
    },
    "extra_text": ""
  },
  "required_refs": [
    {
      "kind": "git_blob",
      "commit": "8172f7ed23cffad8a4f619db49d0584ba8d9b607",
      "path": ".ai/PROTOCOL.md",
      "content_sha256": "c0c2485da18e24a0445c6effebe2396ec79a40f374511407edf1c6583b86ebf2"
    },
    {
      "kind": "git_blob",
      "commit": "8172f7ed23cffad8a4f619db49d0584ba8d9b607",
      "path": ".ai/CODEX_TASK_INPUT_CONTRACT.md",
      "content_sha256": "b960bb251fa33eaddb2211aa59c02e908dce750ffc6b2b4071042f5effda6616"
    }
  ],
  "communication": {
    "recipient_mode": "mixed_separable",
    "channels_separated": true,
    "human_pointer_only_waiver": false,
    "human_operational": {
      "factual_status": "The durable fixture binds physical evidence before a state transition.",
      "execution_recommendation": {
        "recommended_model": "runtime_dependent",
        "recommended_thinking_level": "xhigh",
        "mode": "goal",
        "subagents": "not_applicable",
        "task_ref_or_plan_ref": ".ai/CODEX_TASK_INPUT_CONTRACT.md",
        "short_complexity_rationale": "deterministic material-event fixture",
        "human_gate": "not_required"
      },
      "preflight": {
        "factual_status_grounded": true,
        "required_refs_dereferenced": true,
        "canonical_pointer_present_when_applicable": true,
        "execution_recommendation_present_when_dispatching": true,
        "independent_expression_present_for_material_event": true,
        "independent_expression_separated_from_authority": true,
        "no_long_task_or_report_echo": true,
        "no_hidden_chain_of_thought_request_or_disclosure": true
      },
      "independent_expression": {
        "heading": "Independent expression",
        "text": "Physical evidence makes omissions visible. It never grants protected authority.",
        "separated_from_authority": true
      }
    },
    "brief_artifact_ref": null
  },
  "proposed_transition": {
    "transition_id": "dispatch_to_backend",
    "from_state": "idle",
    "to_state": "awaiting_codex"
  },
  "descriptive_human_gate": "descriptive_only"
}
